{
  "$schema": "https://json-schema.org/draft/2020-12/schema",
  "$id": "https://qor-logic.mythologiq/schemas/gates/audit.schema.json",
  "title": "Audit Gate Artifact",
  "type": "object",
  "additionalProperties": true,
  "required": ["phase", "ts", "session_id", "target", "verdict"],
  "properties": {
    "phase": { "const": "audit" },
    "ts": { "type": "string", "pattern": "^[0-9]{4}-[0-9]{2}-[0-9]{2}T[0-9]{2}:[0-9]{2}:[0-9]{2}Z$" },
    "session_id": { "type": "string", "minLength": 3 },
    "target": { "type": "string", "minLength": 1 },
    "verdict": { "type": "string", "enum": ["PASS", "VETO"] },
    "violations": { "type": "array", "items": { "type": "object" } },
    "risk_grade": { "type": "string", "enum": ["L1", "L2", "L3"] },
    "report_path": { "type": "string" },
    "target_content_hash": {
      "description": "Phase 67 (GH #45): SHA-256 of the plan file content audited in this gate. Enables qor-audit to short-circuit unchanged-plan re-invocation: when a subsequent audit's plan content hash matches a prior audit's recorded value, the skill recommends amendment instead of re-running passes. Optional; absent on pre-Phase-67 artifacts.",
      "type": ["string", "null"],
      "pattern": "^[0-9a-f]{64}$"
    },
    "reviews_remediate_gate": {
      "description": "Phase 36 V1 resolution: explicit signal that this audit reviews a /qor-remediate proposal. Set by /qor-audit when operator passes skill arg 'reviews-remediate:<path>'. Absence => audit does not trigger two-stage addressed flip in mark_addressed. Value is the path to the remediate gate artifact being reviewed (e.g., '.qor/gates/<sid>/remediate.json').",
      "type": ["string", "null"]
    },
    "findings_categories": {
      "description": "Phase 37 B20b: closed enum of VETO finding classes. Required when verdict == 'VETO' (enforced by allOf). Drives findings_signature for stall detection. New categories must be added here by deliberate schema amendment; no 'other' escape hatch.",
      "type": "array",
      "items": {
        "type": "string",
        "enum": [
          "razor-overage",
          "ghost-ui",
          "security-l3",
          "owasp-violation",
          "orphan-file",
          "macro-architecture",
          "dependency-unjustified",
          "schema-migration-missing",
          "specification-drift",
          "test-failure",
          "coverage-gap",
          "infrastructure-mismatch",
          "prompt-injection",
          "feature-test-undeclared"
        ]
      }
    },
    "ai_provenance": { "$ref": "_provenance.schema.json" }
  },
  "allOf": [
    {
      "if": {
        "properties": { "verdict": { "const": "VETO" } },
        "required": ["verdict"]
      },
      "then": { "required": ["findings_categories"] }
    }
  ]
}
