{
  "phase": "audit",
  "session_id": "2026-07-16T0055-a205c4",
  "ts": "2026-07-16T00:59:21Z",
  "target": "docs/plan-qor-phase205-zero-cost-oss-sast.md",
  "verdict": "PASS",
  "risk_grade": "L1",
  "target_content_hash": "dfce71a2da3f72045dce96e3ea39c415e7c08bb18dad1c3b11a3b1e72aa50659",
  "ai_provenance": {
    "system": "Qor-logic",
    "version": "0.133.0",
    "host": "chatgpt-github-connector",
    "model_family": "gpt-5.6-thinking",
    "human_oversight": "pass",
    "ts": "2026-07-16T00:59:21Z"
  }
}
