{
  "phase": "audit",
  "session_id": "2026-05-01T2055-phase58",
  "ts": "2026-05-02T00:33:18Z",
  "target": "docs/plan-qor-phase58-ideation-readiness-phase.md",
  "verdict": "PASS",
  "violations": [],
  "risk_grade": "L2",
  "report_path": ".agent/staging/AUDIT_REPORT.md",
  "reviews_remediate_gate": null,
  "ai_provenance": {
    "system": "Qor-logic",
    "version": "0.42.0",
    "host": "unknown",
    "model_family": "unknown",
    "human_oversight": "absent",
    "ts": "2026-05-02T00:33:18Z"
  }
}