{
  "phase": "audit",
  "session_id": "2026-08-11T1904-581fb2",
  "ts": "2026-08-11T19:17:43Z",
  "target": "docs/plan-qor-phase219-unseen-surface-gates.md",
  "verdict": "PASS",
  "report_path": ".agent/staging/AUDIT_REPORT.md",
  "risk_grade": "L2",
  "target_content_hash": "0d0759783d2ab98739864758dc516d9edf01b3591fc3069ad09e34b6393d5dd3",
  "ai_provenance": {
    "system": "Qor-logic",
    "version": "0.141.0",
    "host": "claude-code",
    "model_family": "opus",
    "human_oversight": "pass",
    "ts": "2026-08-11T19:17:43Z"
  }
}