{
  "phase": "audit",
  "session_id": "2026-09-28T0359-d92786",
  "ts": "2026-09-28T04:24:53Z",
  "target": "docs/plan-qor-phase301-shadow-breach-header.md",
  "verdict": "PASS",
  "report_path": ".agent/staging/AUDIT_REPORT.md",
  "risk_grade": "L2",
  "findings_categories": [],
  "target_content_hash": "71a00e948fa28efea5715a4272cec22e3cea134cd5538bcd28ddfe6c695db2d4",
  "ai_provenance": {
    "system": "Qor-logic",
    "version": "0.175.4",
    "host": "claude-code",
    "model_family": "claude-opus",
    "human_oversight": "pass",
    "ts": "2026-09-28T04:24:53Z"
  }
}