{
  "phase": "audit",
  "session_id": "2026-05-14T1926-cc4683",
  "ts": "2026-05-14T19:28:28Z",
  "target": "docs/plan-qor-phase70-pipeline-inversion-lint-wiring.md",
  "verdict": "PASS",
  "report_path": ".agent/staging/AUDIT_REPORT.md",
  "risk_grade": "L1",
  "ai_provenance": {
    "system": "Qor-logic",
    "version": "0.47.2",
    "host": "unknown",
    "model_family": "opus",
    "human_oversight": "pass",
    "ts": "2026-05-14T19:28:28Z"
  }
}