{
  "phase": "audit",
  "session_id": "2026-06-10T1841-762eb0",
  "ts": "2026-06-10T18:44:45Z",
  "target": "docs/plan-qor-phase162-ledger-base-currency.md",
  "verdict": "PASS",
  "report_path": ".agent/staging/AUDIT_REPORT.md",
  "risk_grade": "L2",
  "ai_provenance": {
    "system": "Qor-logic",
    "version": "0.110.3",
    "host": "unknown",
    "model_family": "unknown",
    "human_oversight": "pass",
    "ts": "2026-06-10T18:44:45Z"
  }
}