{
  "phase": "audit",
  "session_id": "2026-09-09T1707-6ed90c",
  "ts": "2026-09-09T18:26:33Z",
  "target": "docs/plan-qor-phase283-nightly-health-advisory-gate.md",
  "verdict": "PASS",
  "report_path": ".agent/staging/AUDIT_REPORT.md",
  "risk_grade": "L2",
  "ai_provenance": {
    "system": "Qor-logic",
    "version": "0.172.0",
    "host": "claude-code",
    "model_family": "opus",
    "human_oversight": "pass",
    "ts": "2026-09-09T18:26:33Z"
  }
}