{
  "phase": "audit",
  "session_id": "2026-08-18T0319-c7813e",
  "ts": "2026-08-18T03:23:43Z",
  "target": "docs/plan-qor-phase233-ci-lock-verify.md",
  "verdict": "PASS",
  "report_path": ".agent/staging/AUDIT_REPORT.md",
  "risk_grade": "L2",
  "findings_categories": [],
  "ai_provenance": {
    "system": "Qor-logic",
    "version": "0.153.0",
    "host": "claude-code",
    "model_family": "fable",
    "human_oversight": "pass",
    "ts": "2026-08-18T03:23:43Z"
  }
}