{
  "phase": "audit",
  "session_id": "2026-09-02T2038-c5668a",
  "ts": "2026-09-02T20:40:51Z",
  "target": "docs/plan-qor-phase251-commitment-integrity.md",
  "verdict": "VETO",
  "report_path": ".agent/staging/AUDIT_REPORT.md",
  "risk_grade": "L2",
  "findings_categories": [
    "infrastructure-mismatch"
  ],
  "ai_provenance": {
    "system": "Qor-logic",
    "version": "0.164.0",
    "host": "claude-code",
    "model_family": "claude",
    "human_oversight": "veto",
    "ts": "2026-09-02T20:40:51Z"
  }
}