{
  "phase": "audit",
  "session_id": "2026-08-31T0428-f6844d",
  "ts": "2026-08-31T04:28:25Z",
  "target": "docs/plan-qor-phase245-qor-refactor-modernization.md",
  "verdict": "PASS",
  "report_path": ".agent/staging/AUDIT_REPORT.md",
  "risk_grade": "L2",
  "ai_provenance": {
    "system": "Qor-logic",
    "version": "0.161.0",
    "host": "claude-code",
    "model_family": "claude",
    "human_oversight": "pass",
    "ts": "2026-08-31T04:28:25Z"
  }
}