{
  "phase": "audit",
  "session_id": "2026-05-22T0236-09b540",
  "ts": "2026-05-22T04:13:57Z",
  "target": "docs/plan-qor-phase83-audit-phase37-hardening.md",
  "verdict": "PASS",
  "report_path": ".agent/staging/AUDIT_REPORT.md",
  "risk_grade": "L2",
  "ai_provenance": {
    "system": "Qor-logic",
    "version": "0.55.2",
    "host": "unknown",
    "model_family": "opus",
    "human_oversight": "pass",
    "ts": "2026-05-22T04:13:57Z"
  }
}