{
  "phase": "audit",
  "session_id": "2026-08-12T0214-799d77",
  "ts": "2026-08-12T05:32:16Z",
  "target": "docs/plan-qor-phase223-grep-evidence-truth.md",
  "verdict": "PASS",
  "report_path": ".agent/staging/phase223-plan-iter5-AUDIT_REPORT.md",
  "risk_grade": "L2",
  "findings_categories": [],
  "reviews_remediate_gate": null,
  "ai_provenance": {
    "system": "Qor-logic",
    "version": "0.145.0",
    "host": "claude-code",
    "model_family": "claude",
    "human_oversight": "pass",
    "ts": "2026-08-12T05:32:16Z"
  }
}