{
  "phase": "audit",
  "session_id": "2026-09-09T2036-2cfe02",
  "ts": "2026-09-09T21:31:32Z",
  "target": "docs/plan-qor-phase284-threshold-self-counting.md",
  "verdict": "VETO",
  "report_path": ".agent/staging/AUDIT_REPORT.md",
  "risk_grade": "L2",
  "findings_categories": [
    "specification-drift",
    "coverage-gap"
  ],
  "ai_provenance": {
    "system": "Qor-logic",
    "version": "0.172.1",
    "host": "claude-code",
    "model_family": "opus",
    "human_oversight": "veto",
    "ts": "2026-09-09T21:31:32Z"
  }
}