{
  "phase": "audit",
  "session_id": "2026-08-17T2339-3385b4",
  "ts": "2026-08-17T23:46:47Z",
  "target": "docs/plan-qor-phase231-intent-lock-evidence.md",
  "verdict": "PASS",
  "report_path": ".agent/staging/AUDIT_REPORT.md",
  "risk_grade": "L2",
  "findings_categories": [],
  "ai_provenance": {
    "system": "Qor-logic",
    "version": "0.151.0",
    "host": "claude-code",
    "model_family": "fable",
    "human_oversight": "pass",
    "ts": "2026-08-17T23:46:47Z"
  }
}