{
  "phase": "audit",
  "session_id": "2026-07-15T2250-a205c2",
  "ts": "2026-07-15T22:33:55Z",
  "target": "docs/plan-qor-phase205-codeql-security-baseline.md",
  "verdict": "PASS",
  "risk_grade": "L1",
  "target_content_hash": "c6c2aff3590441e4f1e7c4abb07150aaeb9d52bb16e3b94ac825c31c7561e38b",
  "ai_provenance": {
    "system": "Qor-logic",
    "version": "0.133.0",
    "host": "chatgpt-github-connector",
    "model_family": "gpt-5.6-thinking",
    "human_oversight": "pass",
    "ts": "2026-07-15T22:33:55Z"
  }
}
