{
  "phase": "audit",
  "session_id": "2026-07-04T0803-3fde29",
  "ts": "2026-07-04T14:26:09Z",
  "target": "docs/plan-qor-phase166-sg-closure-enforcement.md",
  "verdict": "PASS",
  "report_path": ".agent/staging/AUDIT_REPORT.md",
  "risk_grade": "L2",
  "target_content_hash": "a43e590e821892942c604d6a83e89907a38ee39ba756c83095bd07a3d4df534e",
  "ai_provenance": {
    "system": "Qor-logic",
    "version": "0.113.0",
    "host": "unknown",
    "model_family": "unknown",
    "human_oversight": "pass",
    "ts": "2026-07-04T14:26:09Z"
  }
}