{
  "phase": "audit",
  "session_id": "2026-07-13T1255-08b7e7",
  "ts": "2026-07-13T11:13:02Z",
  "target": "docs/plan-qor-phase189-onboard-tutorial.md",
  "verdict": "PASS",
  "report_path": ".agent/staging/AUDIT_REPORT.md",
  "risk_grade": "L1",
  "target_content_hash": "8c8d174e34f105b89b7f3dac2c7e17aaddf5e22e17736a90884684d4876f5d1f",
  "ai_provenance": {
    "system": "Qor-logic",
    "version": "0.127.0",
    "host": "claude-code",
    "model_family": "unknown",
    "human_oversight": "pass",
    "ts": "2026-07-13T11:13:02Z"
  }
}