{
  "phase": "audit",
  "session_id": "2026-09-23T1628-c67a6a",
  "ts": "2026-09-23T16:30:12Z",
  "target": "docs/plan-shadow-escalation-origin-signature-current.md",
  "verdict": "PASS",
  "report_path": ".agent/staging/phase292-AUDIT_REPORT.md",
  "risk_grade": "L1",
  "target_content_hash": "bfec0225d22a22784785e6dec0da8ccdc42ea9a438f2ecbbd2f166271f3649c7",
  "ai_provenance": {
    "system": "Qor-logic",
    "version": "0.174.2",
    "host": "claude-code",
    "model_family": "unknown",
    "human_oversight": "pass",
    "ts": "2026-09-23T16:30:12Z"
  }
}