{
  "phase": "audit",
  "session_id": "2026-09-04T1551-477d51",
  "ts": "2026-09-04T18:01:07Z",
  "target": "docs/plan-qor-phase258-adr-contract-and-status-lint.md",
  "verdict": "VETO",
  "report_path": ".agent/staging/AUDIT_REPORT.md",
  "risk_grade": "L2",
  "findings_categories": [
    "specification-drift",
    "test-failure"
  ],
  "ai_provenance": {
    "system": "Qor-logic",
    "version": "0.169.0",
    "host": "claude-code",
    "model_family": "claude",
    "human_oversight": "veto",
    "ts": "2026-09-04T18:01:07Z"
  }
}