{
  "phase": "audit",
  "session_id": "2026-05-29T1946-183804",
  "ts": "2026-05-29T21:34:50Z",
  "target": "docs/plan-qor-phase118-module-reachability-cli-dispatch.md",
  "verdict": "PASS",
  "report_path": ".agent/staging/AUDIT_REPORT.md",
  "risk_grade": "L2",
  "ai_provenance": {
    "system": "Qor-logic",
    "version": "0.84.0",
    "host": "unknown",
    "model_family": "unknown",
    "human_oversight": "pass",
    "ts": "2026-05-29T21:34:50Z"
  }
}