{
  "phase": "audit",
  "session_id": "2026-10-05T1757-41eb02",
  "ts": "2026-10-05T18:09:06Z",
  "target": "docs/plan-qor-phase304-maintenance-freeze.md",
  "verdict": "VETO",
  "report_path": ".agent/staging/AUDIT_REPORT.md",
  "risk_grade": "L2",
  "findings_categories": [
    "coverage-gap"
  ],
  "target_content_hash": "78919121ae95ebb52c0673b222398a6284df31909b6a20238187dac53b34ab10",
  "ai_provenance": {
    "system": "Qor-logic",
    "version": "0.175.7",
    "host": "claude-code",
    "model_family": "claude-opus",
    "human_oversight": "veto",
    "ts": "2026-10-05T18:09:06Z"
  }
}