{
  "phase": "audit",
  "session_id": "2026-09-16T0321-901b4c",
  "ts": "2026-09-16T03:33:23Z",
  "target": "docs/plan-qor-phase289-escalation-origin-signature.md",
  "verdict": "PASS",
  "report_path": ".agent/staging/phase289-AUDIT_REPORT.md",
  "risk_grade": "L1",
  "target_content_hash": "a91812e2b2bb9ddbd160d3fdfbc0300107efe582c2a3d3831cc3ff8442fccc56",
  "ai_provenance": {
    "system": "Qor-logic",
    "version": "0.174.0",
    "host": "claude-code",
    "model_family": "unknown",
    "human_oversight": "pass",
    "ts": "2026-09-16T03:33:23Z"
  }
}