{
  "phase": "audit",
  "session_id": "2026-09-02T1859-a6d0aa",
  "ts": "2026-09-02T19:06:29Z",
  "target": "docs/plan-qor-phase249-bootstrap-seed-correctness.md",
  "verdict": "PASS",
  "report_path": ".agent/staging/AUDIT_REPORT.md",
  "risk_grade": "L2",
  "findings_categories": [],
  "ai_provenance": {
    "system": "Qor-logic",
    "version": "0.163.2",
    "host": "claude-code",
    "model_family": "claude",
    "human_oversight": "pass",
    "ts": "2026-09-02T19:06:29Z"
  }
}